league_id,name,country,founded_year,description,logo_url
1,"Premier League","England",1992,"Top professional football league in England.",
2,"La Liga","Spain",1929,"Top professional football division of the Spanish league system.",
3,"Bundesliga","Germany",1963,"Germany's primary professional football league.",
4,"Serie A","Italy",1898,"Top Italian professional league for football clubs.",
5,"Russian Premier League","Russia",2001,"Top division professional football league in Russia.",
6,"UEFA Champions League","Europe",1955,"Placeholder for top European club competition matches.",